{
  "checks": [
    {
      "name": "inputs_available",
      "observed": "10/10",
      "passed": true,
      "required": "10/10 inputs present"
    },
    {
      "name": "readiness_reproduces",
      "observed": "smoke_ready",
      "passed": true,
      "required": "readiness verifier ok"
    },
    {
      "name": "protocol_reproduces",
      "observed": "smoke_protocol_locked",
      "passed": true,
      "required": "protocol verifier ok"
    },
    {
      "name": "design_reproduces",
      "observed": "smoke_design_observed",
      "passed": true,
      "required": "design verifier ok"
    },
    {
      "name": "claim_reproduces",
      "observed": "smoke",
      "passed": true,
      "required": "claim-card verifier ok"
    },
    {
      "name": "bundle_reproduces",
      "observed": 77,
      "passed": true,
      "required": "bundle verifier ok"
    },
    {
      "name": "paper_reproduces",
      "observed": 43,
      "passed": true,
      "required": "paper manifest verifier ok"
    }
  ],
  "claim_allowed": false,
  "commands": [
    {
      "command": "python -m tracerazor.trice suite verify-readiness docs/trice_suite_readiness.json --manifest examples/trice_suite_bundled_live.json",
      "name": "verify-readiness",
      "purpose": "Verify suite readiness card.",
      "sha256": "86ca731546337ec80d7c23f30f142f964758bd844b3842732525fa84e1e72f56"
    },
    {
      "command": "python -m tracerazor.trice verify-protocol docs/trice_protocol_lock.json --manifest examples/trice_suite_bundled_live.json",
      "name": "verify-protocol",
      "purpose": "Verify protocol lock.",
      "sha256": "3bb35232889d742c9426f6040f732f0310b94153db61c107e0c9a98b8e997d5c"
    },
    {
      "command": "python -m tracerazor.trice verify-design docs/trice_design_card.json --protocol docs/trice_protocol_lock.json --suite-result benchmark/trice/results/v2-broad-smoke/trice_suite_results.json",
      "name": "verify-design",
      "purpose": "Verify statistical design card.",
      "sha256": "fc7863596d03d6e321c8a1a38eee40f59c3e317d2c61eea71fd898cacbead3f2"
    },
    {
      "command": "python -m tracerazor.trice verify-claim docs/trice_claim_card.json --suite-result benchmark/trice/results/v2-broad-smoke/trice_suite_results.json --manifest benchmark/trice/results/v2-broad-smoke/trice_suite_evidence_manifest.json",
      "name": "verify-claim",
      "purpose": "Verify deterministic claim card.",
      "sha256": "1c328b3771b3a7e1ba337b59d5a46d15e966b3236e61e12f0e38a372624206d0"
    },
    {
      "command": "python -m tracerazor.trice verify-bundle benchmark/trice/results/v2-broad-smoke/trice_broad_smoke_evidence.trice.zip",
      "name": "verify-bundle",
      "purpose": "Verify portable evidence bundle.",
      "sha256": "19d410911fe88fd6c72596b132d46b878053e7193c094e026d63ccc2ec5999a1"
    },
    {
      "command": "python -m tracerazor.trice verify paper/trice_v3_research_manifest.json --result benchmark/trice/results/v2-smoke/trice_v2_live_results.json",
      "name": "verify-paper",
      "purpose": "Verify paper manifest and generated artifacts.",
      "sha256": "46a946c7471dd2eadfab90a359cf0148093b1eecc6e740ea9d6c1d252ca6cf36"
    },
    {
      "command": "python -m tracerazor.trice verify-artifact docs/trice_artifact_card.json",
      "name": "verify-artifact",
      "purpose": "Verify final artifact card after it has been regenerated.",
      "sha256": "05946657b30c14d6d761ee3c61583728aa661dded680f2751db56ec9980d43c7"
    }
  ],
  "inputs": {
    "broad_evidence_bundle": {
      "bytes": 117496,
      "path": "benchmark/trice/results/v2-broad-smoke/trice_broad_smoke_evidence.trice.zip",
      "present": true,
      "sha256": "a43eeac3ba5239031376aa7b3be97e01ccada6c36648faa15e1c2b3e2d2d2564"
    },
    "broad_suite_manifest": {
      "bytes": 2428,
      "path": "benchmark/trice/results/v2-broad-smoke/trice_suite_evidence_manifest.json",
      "present": true,
      "sha256": "52a8c1d9f25ccba7af642cf461c0b77b382cc107a880df9213a121296a2b235a"
    },
    "broad_suite_result": {
      "bytes": 17161,
      "path": "benchmark/trice/results/v2-broad-smoke/trice_suite_results.json",
      "present": true,
      "sha256": "1622ffb36464e6e41cbadecd1c5ed6cceb678af89a2a5a5a3c999258559c3f2d"
    },
    "claim_card": {
      "bytes": 3861,
      "path": "docs/trice_claim_card.json",
      "present": true,
      "sha256": "43fbd6d1329da52fb78239ace0037f0cfb1a460ab3a281ebaff1f4dc99f7d4c6"
    },
    "design_card": {
      "bytes": 4605,
      "path": "docs/trice_design_card.json",
      "present": true,
      "sha256": "cbdbb49b901d8c51e6e76504cc7f664b86177dc84f1ee7879345bf8d98261a0b"
    },
    "paper_manifest": {
      "bytes": 7362,
      "path": "paper/trice_v3_research_manifest.json",
      "present": true,
      "sha256": "cc0ed7cdf452a6fe10d378b21a41992ef32c6ff33cd568ad78b80d424e73ee81"
    },
    "paper_result": {
      "bytes": 45736,
      "path": "benchmark/trice/results/v2-smoke/trice_v2_live_results.json",
      "present": true,
      "sha256": "edf72f856f37e2c773ffefc31c2ae0b06cab67cc6e456044df3ff03911b58d8a"
    },
    "protocol_lock": {
      "bytes": 7194,
      "path": "docs/trice_protocol_lock.json",
      "present": true,
      "sha256": "3e71413180ad94f43be0b6a35717ced48359b75ea382035c524a9b91e5e8296e"
    },
    "readiness": {
      "bytes": 5903,
      "path": "docs/trice_suite_readiness.json",
      "present": true,
      "sha256": "f98e2481ce47a262e618f0adee5481ee7227347e900613bfc68115cc420be1d7"
    },
    "suite_manifest": {
      "bytes": 2066,
      "path": "examples/trice_suite_bundled_live.json",
      "present": true,
      "sha256": "fd4335bea5164e4e0dd479ff5154947c54941d9c9704258b018b51c172a7859b"
    }
  },
  "next_actions": [
    "Publish the reproduction card with release assets.",
    "Run the listed commands in a clean wheel install before public release.",
    "Do not claim S-tier until held-out claim evidence and claim card pass."
  ],
  "python_executable": "python",
  "reproduction_card_sha256": "620e78496b2071b9139fa0b55df908c0cbd7d1b13798907e285753da664d90cd",
  "reproduction_level": "reviewer_replay_ready_smoke",
  "reproduction_score": 100,
  "research_basis": [
    "Reproduction should be possible from documented commands, not only from prose.",
    "FAIR and RO-Crate-style packaging motivate explicit inventories, metadata, and machine-checkable paths.",
    "Artifact-review practice separates availability, functionality, and independent reproduction.",
    "TRICE reproduction cards bind commands and input hashes while leaving S-tier outcome claims to claim cards."
  ],
  "schema_version": "trice-reproduction-card/v1",
  "verdicts": {
    "claim_card": {
      "claim_level": "smoke",
      "errors": [],
      "ok": true
    },
    "design_card": {
      "design_level": "smoke_design_observed",
      "errors": [],
      "ok": true
    },
    "evidence_bundle": {
      "entry_count": 77,
      "errors": [],
      "ok": true
    },
    "paper_manifest": {
      "errors": [],
      "ok": true
    },
    "protocol_lock": {
      "errors": [],
      "ok": true,
      "protocol_level": "smoke_protocol_locked"
    },
    "readiness": {
      "errors": [],
      "ok": true,
      "readiness_level": "smoke_ready"
    }
  }
}
